{"version":1,"name":"seam","use_case":"seam","projection":"equirectangular","inputs":{"image":{"type":"Image"}},"step":[{"id":"cut","op":"cut","inputs":{"image":"inputs.image"},"strip":0.07},{"id":"line","op":"line","inputs":{"image":"cut.image"},"column":0.5},{"id":"fan","op":"fan","inputs":{"image":"cut.image","line":"line.location"},"constants":"fan-v1"},{"id":"band","op":"profile","inputs":{"band":"fan.band"},"constants":"profile-v1"},{"id":"ramp","op":"ramp","inputs":{"image":"cut.image","mask":"band.mask"},"constants":"ramp-v1"}],"outputs":{"mask":"ramp.mask","image":"cut.image","plan":"cut.plan","render":[{"for":"grey","out":"seam-grey.png"}]}}
